{
  "MMSI": "215811000",
  "IMO": "9839272",
  "SHIP_ID": "5410912",
  "PREDICTED_DESTINATION_PORT": "ROTTERDAM",
  "PREDICTED_DESTINATION_UNLOCODE": "NLRTM",
  "PREDICTED_DESTINATION_PROBABILITY": 0.94,
  "PREDICTED_ETA_UTC": "2026-06-09T15:42:00Z",
  "AIS_DESTINATION": "ROTTERDAM",
  "AIS_ETA_UTC": "2026-06-09T07:00:00Z",
  "SPEED_AVG_KN": 14.3,
  "ROUTE_DISTANCE_NM": 3287.5,
  "DESTINATION_AREAS": [
    { "PORT_ID": "12",   "PORT_NAME": "ROTTERDAM",      "UNLOCODE": "NLRTM", "PROBABILITY": 0.94 },
    { "PORT_ID": "169",  "PORT_NAME": "ANTWERP",        "UNLOCODE": "BEANR", "PROBABILITY": 0.04 },
    { "PORT_ID": "1183", "PORT_NAME": "HAMBURG",        "UNLOCODE": "DEHAM", "PROBABILITY": 0.02 }
  ],
  "GENERATED_AT_UTC": "2026-05-25T14:30:00Z"
}
